id,title,slug,image,text,text,tags,stext,tags
1,Секреты создания уютного дома,,,"Каждому из нас хочется жить в красивом и уютном доме. Вот несколько простых советов, которые помогут вам сделать жом именно таким.
Первое, на что обращает внимание человек при входе в квартиру – это запах. Запах создает особый настрой и является именно то деталью, которая делает дизайн интерьера полностью завершенным.
В основе восприятия любого интерьера лежит цвет. От выбранной цветовой гаммы зависит, какой будет обстановка: расслабляющей или бодрящей. Если интерьер в целом вам нравится, но все равно беспокоит какое-то непонятное ощущение, это означает, что пора сменить цвет.
Чем ближе человек находится к природе, тем лучше он себя чувствует. Это доказано многими научными исследованиями. Поэтому для хорошего настроения необходимо иметь у себя дома кусочек живой природы. Зеленые растения в горшочках, аквариум, небольшой фонтанчик, - все это принесет свежесть и гармонию в дом.
Стильные детали, милые сердцу мелочи, вещички, которые вам безумно нравятся, сделают интерьер уникальным отражением вашей индивидуальности. Пусть даже они не будут вписываться по стилю или по цвету, не важно! Главное, чтобы они дарили нам радость и удовольствие.
Создать уютную атмосферу без достаточного количества воздуха просто невозможно. Сделайте комнаты более просторными, выкинув ненужные вещи и старый хлам. Очистите залежи старья в кладовках, на антресолях и в глубинах платяного шкафа.",,,,
2,Интерьер,,,"Современный человек, обитатель больших бетонных джунглей, значительную часть своего времени проводит в помещениях, будь это жилая комната, гостиная или рабочий кабинет. Каждый человек сам себе творец и художник когда придумывает обстановку для своей пещеры, алтаря домашнего очага. Но порой очень сложно решить, каким цветом сделать стены, какую выбрать мебель. Есть желания и мечты, а когда приходишь в большой магазин и бродишь с растерянным взглядом, то хочется в сердце кричать от отчаяния, и покупаешь не то, что хочешь, а то, что первое понравится и попадётся под руку. А когда приходишь домой то обнаруживаешь, что одно не подходит ко второму, а четвёртое к первому, и всё вокруг становится тяжёлым, кажется, что стены давят, а мебель вот-вот рухнет на тебя. Начинаются неудачи на работе, в жизни, частые болезни, усталость, и не понимаешь, почему так. Может это из-за настроения, с которым ложишься спать, просыпаешься, которое появляется, когда приходишь домой. А настроение такое потому, что не отдыхаешь дома, душа не хочет петь, не хочет радоваться тому, что окружает тебя. А ещё говорят «дом моя крепость», уверен, в пустой комнате покажется лучше, чем там, где не хочешь жить, там, куда не хочешь вернуться вечером, куда не идёшь с хорошим настроением, потому что счастлив, что наконец идёшь домой. Не существует плохих блюд или невкусной еды, природа не случайно создала так много всего интересного и уникального. Гениальные произведения кулинарного искусства рождаются только в полной гармонии составляющих друг с другом, на тонкой грани гениального, между испорченным блюдом и пригодным для пищи, когда есть всё, и нет ничего лишнего. Дизайн интерьера это искусство, музыка, которая рождается на голых стенах, как рождается поэзия на листах бумаги, возвышенная и нежная, а может и стремящаяся к какой-то цели. И поэтому очень важно правильно подходить к выбору окружения в пространстве, в котором мы находимся, цветовые решения, мебель, каждая деталь и мелочь влияет на наше сознание и психику, определяет наши эмоции и ощущения. Один художник дал определение красоты, красота – это сумма правильно взаимодействующих частиц. Гармоничное сочетание крохотных частиц, которые вызывают чувства наслаждения, эйфорию и блаженства, как кусочек шоколада, от которого становится на душе немного лучше, и чувствуешь себя счастливым. Или такое сочетание частиц, при котором чувствуешь себя уверенней и целеустремлённей. Интерьер и помещение, как и еда, это не только способ продления жизни, это искусство, если вы пробуете пищу ради того, чтобы насладиться вкусом, погрузиться в мечты, ощутить все оттенки жизни. Насладиться маленьким счастливым моментом, которым будешь наслаждаться, пока не проглотил пищу, или пока не вышел из той комнаты, где испытывал что-то, что в голове, а может и в душе, какие-то чувства, эмоции, счастье. Если вам не безразличны ваши чувства, то стоит обратиться к тем, кто понимает язык вашей души, кто с лёгкостью поймёт, чего вы хотите, кто сделает всё легко и изящно со вкусом, волшебно и сказочно красиво, если вы захотите этого.",,,,
3,Дизайн интерьера. Зонирование пространства мебелью.,,,"Каждый раз, покупая новую мебель, встаёт один и тот же вопрос: «как лучше её разместить и поместится ли?» И насколько верно вы сможете ответить на него, зависит  будущий уют, атмосфера и благополучие дома. Именно правильная расстановка мебели в доме является решающим моментом в создании грамотного интерьера.
Меньше всего сложностей с расстановкой мебели испытывают те, кто имеет достаточно большие комнаты, поскольку у них есть возможность расставить её вдоль стен. К тому же этот метод расстановки визуально увеличивает комнатное пространство за счёт того, что заполняются края помещения. Расстановка мебели «вдоль стен» превращает мебель в плавную, линию, огибающую стены. 
Но если расставить мебель в разных местах комнаты, то можно добиться выразительных акцентов, создающих яркий интерьер. И помогут в этом диваны, хрупкие и тонкие этажерки, ширмы, стеллажи, выполняющие, как правило, функцию зонирования.  А зонирование является очень важным вопросом при перепланировке квартиры, в которой планируется совместить гостиную и прихожую, столовую и кухню или другие зоны.  Используя лишь подручные средства (ковры, мебель, разные цвета потолка и стен)  можно великолепно организовать различные по назначению и направлению зоны. 
Например, расположив полукруглый кожаный диван и массивные кресла в центре гостиной на глянцевом паркетном полу, вокруг домашнего кинотеатра, можно создать уютную зону для отдыха всей семьи и для приёма гостей. 
Отлично зонируют пространство маленькие журнальные столики с коваными ножками, которые кажутся очень хрупкими, но на самом деле довольно прочные и крепкие. В их ящичках можно разместить все необходимые мелкие вещи для спокойного отдыха. Если такой столик поставить под углом к стене, то даже таким нехитрым приёмом получаем некоторую новизну и выразительность интерьера. 
Разнообразие внутренней атмосфере помещения  придадут напольные часы, деревянные или кованые подставки для цветов, всевозможные вазы. Все эти предметы, поставленные в неожиданных местах комнаты, и просто посередине её будут смотреться свежо и очень оригинально. Так, например, подставка для цветов, на которой разместился папоротник с красиво свисающими листьями, отлично разделит гостиную зону и столовую. А вот разделить прихожую и гостиную лучше всего сможет элегантная банкетка. 
Великолепно подходит для зонирования пространства передвижная мебель на роликах или колёсиках. Так, например, поставленный на колёсики раскладной обеденный стол, позволяет легко и без проблем перемещать его по комнате, а в случае ненадобности можно его просто сложить и убрать в укромное место. 
Конечно, размещать мебель каждый может по своему вкусу, но всё же существуют некоторые обязательные правила. И одно из таких правил – запрет размещения мягкой мебели в тех местах, где на неё будет направлено интенсивное воздействие прямых солнечных лучей. Это связано с тем, что обивка мягких кресел и диванов может просто выгореть на солнце.
Так же не следует размещать цветочные горшки и вазоны  над стеллажами и полками с книгами, стойками и тумбочками с аудио- и видеоаппаратурой, так как во время полива цветов есть опасность повредить предметы и технику, стоящие на стеллажах.",,,,
4,Дизайн интерьера детской комнаты.,,,"Ребенок больше всего времени проводит в детской комнате. Там он делает уроки, играет. Многие родители задумываются над тем, как сделать комнату для ребенка наиболее комфортной. Не следует в детской комнате вешать на стену фотографии и картины в рамочках. Самым лучшим вариантом для стен будут специальные детские обои с изображением сказочных героев. Или можно стены просто украсить художественной росписью. Для девочек лучше изобразить бабочек и цветы, а для мальчика можно изобразить героев мультфильма. Окрашенные стены в детской комнате хороши тем, что если вдруг стену испачкать, то это место вы можете просто замазать краской. 
На пол в детской ни в коем случае нельзя стелить линолеум, ламинат и другие искусственные материалы. Потому что они выделяют вредные вещества, которые плохо влияют на самочувствие ребенка. У ребенка может появиться аллергия, кашель. Лучше на пол постелить кавролин или небольшой ковер в игровой зоне. С натуральным материалом можно не бояться за здоровье ребенка. К тому же пол будет мягким и ребенок, при падении, ничего не повредит. 
Экономить на освещении в детской комнате не стоит. Обычная лампа в центре будет давать блики, и глаза вашего ребенка будут быстро уставать. Лучше установить в центре потолка плоский большой плафон. Очень популярны сейчас точечные светильники, которые встроены в потолке. Вот они дают хороший, яркий свет, а главное не ослепляют глаза. В интерьер комнаты для ребенка они хорошо впишутся. У изголовья кровати можно установить светильник, с регулировкой яркости цвета, для того, чтобы ваш ребенок не боялся засыпать. 
А какую же цветовую гамму для детской комнаты выбрать? Желтый цвет в детской комнате повышает настроение, увеличивает остроту зрения. Зеленый цвет помогает сконцентрировать внимание, и успокаивает. Можете обставить комнату ребенка зеленой мебелью, купить зеленые игрушки. Хорошо освежают детскую и поднимают настроение пастельные цвета. Можете пофантазировать и окрасить стены в разные цвета. Можете, например, одну стену сделать голубой, другую персиковой и т.д. 
Мебель в детской комнате должна быть, в первую очередь, безопасной. На ней не должно быть острых углов. Она должна быть обязательно, изготовлена их хороших и качественных материалов. И главное, всегда учитывайте мнение ребенка, ведь это его детская комната, и она должна ему нравиться.",,,,
5,Стили рококо в дизайне интерьера,,,"Стиль рококо – роскошный и утонченный, декоративный и орнаментальный, отодвинувший на второй план конструктивность пространства и тектонику. Стиль причудливых и изысканных форм в ущерб даже функциональности, но в меру, не в ущерб комфорту. Стиль рококо иррационален, капризен. Все в рококо некрупное, изящное, грациозное. 
Стиль зародился в начале XVIII века и прошел три основных этапа в своем развитии. Первым этапом был так называемый стиль Регентства, который на начальном этапе еще сохраняет некоторые черты французского барокко. Постепенно формы становятся заметно легче, сохраняется общая симметрия декоративных решений. Однако размещение отдельных элементов – завитков, гирлянд, букетов – свободное, что усиливает ощущение изящества в интерьере в целом. Приветствуется пышный бронзовый, фарфоровый, живописный декор. Особую любовь декораторы этого периода испытывают к вставкам, накладкам, лакам.
Золотой век рококо совпадает с правлением французского короля Людовика XV, по имени которого он, собственно, и называется. Стиль Людовика XV – это обилие резьбы в виде картуше и раковин, симметричное расположение украшений из завитков с цветами и лентами. Дизайн интерьера в стиле Людовика XV  - это нежные светлые тона, умеренные росписи, легкое золочение и белый лак. Признаком утонченного вкуса в этот период считаются в мебельном декоре – вставки из фарфора, миниатюры, живопись на стекле, восточные лаки.
В наше время стиль Людовика XV в дизайне мебели чаще всего обыгрывается в духе постмодернизма, создавая настроение обдуманной шаловливости. 
Завершающий этап в развитии стиля рококо в дизайне интерьеров связывают с именем английского мебельщика Чиппендейла, который возглавлял мастерскую по изготовлению мебели и занимался не только производство отдельных предметов мебели и декора, но и решением интерьеров в целом. Стиль Чиппендейла отличается от французского рококо. Он использует постмодернистское видение интерьера, сочетая в создаваемых предметах элементы рококо и готики. Предпочитаемый материал – красное дерево. Стулья с простыми прямыми ножками по китайским образцам имеют ажурные спинки, изогнутые в виде запутанного переплетения лент, шнуров, цветов и листьев. Предметы гнутых форм с широкой лобовой частью имеют ножки с орлиными когтями или львиной лапой, сжимающими шар. Кровати имеют балдахины в виде китайской пагоды. Стиль Чиппендейла в дизайне интерьеров имеет репутацию солидного и индивидуально сдержанного.",,,,
