id,title,slug,image,text,text,tags,stext,tags
,Дизайн интерьера ,,,"Зная главные принципы дизайна интерьера, можно придать любому пространству сказочный вид. Ведь так приятно входить в уютное помещение, которое красиво отделано, нахождение в таком помещении подарит вам покой и чувство гармонии. Вы можете достичь эффекта такого же уровня в собственном доме с минимумом знаний об основных принципах дизайна. Соединив эти теорию с практикой и экспериментом, вы сможете создать красивый и уютный дом. 
Баланс
Баланс помогает создать равновесие в пространстве. Это касается выравнивания поверхностей и придания им визуальной невесомости. Баланс достигается не только с использованием формы, цвета, узора, текстуры, а  и использованием других приемов.
•	Создание симметрии. Оформленные в традиционном стиле пространства обычно требуют симметрии. Например, два кресла по обе стороны от журнального столика создают симметричный баланс. Он легко достигается в качестве элемента дизайна, но он стандартен, поэтому  выглядит однообразно и скучно.
•	Создание асимметрии – более сложный и интересный процесс дизайна. Использование визуальных эффектов, линий, цвета и текстуры без точного дублирования. Например, Диван можно сбалансировать, размещением стульев в противоположной стороне.
•	Радиальный баланс создается выбором центра и путем сочетания его с другими элементами вокруг. Примером может быть круглый обеденный стол с расположенными вокруг него стульями. 
Ритм 
Ритм в дизайне интерьера создается повторением. Вы можете повторить форму или цвет. Обивка дивана из хлопчатобумажной ткани красного цвета. Он повторяется в произведение искусства на стене и  на обивке стульев. В свою очередь, основной цвет мебели повторяется на подушках, которые размещаются между подушками цвета обивки. Как и в музыке, ритм в дизайне интерьера создается контрастностью и повторением, что в итоге дает помещению интересный колорит. Блуждающий взгляд по комнате ловит повторяющийся цвет на картине и как эхо цвет повторяется в ковре. Эти повторы цвета привлекают взгляд.
Гармония 
Гармония создается когда, все элементы соединены воедино и создает ощущение покоя. Так, используя только один цвет можно создать гармонию, даже если ваша мебель сильно различается по форме, размеру и материалу изготовления. Гармония достигается использованием  аналогичных цветов и текстур. Например, использование различных оттенков серых и золотых тонов могут создать атмосферу покоя, а небольшие стеклянные аксессуары станут гармоничным продолжением темы.
Акцент 
Выберите предмет мебели, представляющий собой действительную художественную ценность, и сделайте на нем акцент. Комната, где нет ничего яркого, такого как красивый камин или окно с красивым видом бывает скучно и серо. Акцент можно сделать сгруппировав мебель.

Масштаб и пропорции 
В дизайне интерьера особенно важно соблюдать пропорции и масштаб, большой растянутый диван в маленькой комнате не может не нарушить пропорции.",,,,
,Японский стиль в интерьере,,,"Следует отметить, что японский стиль – это, прежде всего, минималистично-декоративный стиль, где пространство структурировано внятно, и ничто не перегружает внимания. 
Японский стиль приобрел особую популярность за счет своей функциональности, необыкновенности в вопросе стилевых решений, а также за счет своей элегантности. 
Дизайн интерьера, выдержанного в японском стиле, достаточно тесно связан с материалами природного происхождения, композициями и цветами. Идеальным продолжением такого интерьера выступает естественный пейзаж. 
Японский стиль имеет лаконичные формы и безупречные цветовые сочетания. Важно понимать, что у японцев отношение к природе особенное, поэтому японский стиль ассоциируется исключительно с природными тонами светлой гаммы: молочный, белый, кремовый, а также оттенки бежевого. Поверхность стен и мебели здесь нефактурная и гладкая. Ткани преимущественно натуральные – белые и кремовые: шелк и хлопок. Важно понимать, что в интерьере, выдержанном в японском стиле, место для отдыха расположено в самом центре комнаты. 
Японский стиль имеет свойство успокоения: закрыв за собой входную дверь, можно оставить все проблемы снаружи. Весь секрет заключается в отсутствии ненужных, совершенно лишних предметов, которые способны отвлекать человека от позитивного настроя. 
Кроме всего прочего, японский стиль достаточно лаконично вписывается в основные требования к интерьеру: быть уютным и современным жильем. Данный стиль позволяет разместить в пространстве все, что выдержано в духе минимализма. Здесь важно четко соблюдать определенную направленность дизайна, а также цветовую гамму.",,,,
,"Дизайн интерьера ресторана, магазина, офиса",,,"Дизайн помещения может многое рассказать о той деятельности, которая в нем происходит. Зачастую люди думают, что только дизайн дома имеет большое значение, однако это не так. Иногда дизайн ресторана, магазина или офиса играет ключевую роль в деятельности организаций, занимающих данные помещения. 
В дизайне нежилых помещений можно выделить несколько направлений: дизайн интерьера ресторана или магазина и дизайн интерьера офиса. Что касается дизайна ресторана и магазина, то тут одну из ключевых ролей играет красота, так как необходимо привлечь покупателей. А вот в интерьере офиса, важна не только красота, но и функциональность, а также удобство. В отличие от магазина, в офисе люди проводят практически целый день. Поэтому очень важно, чтобы данное место нравилось со всех позиций. В первую очередь офис должен быть удобным, там не должно быть ничего лишнего, а только всё мотивирующее и позитивное. 
Особая роль в офисе отведена функциональности. Но, в то же время интерьер не должен держать работников в напряжении. Должна присутствовать дружелюбная дисциплина и порядок. Важно понимать, что офис является тем местом, куда приходят клиенты и деловые партнёры. Это в свою очередь дает понять, что интерьер должен быть таким, чтобы тот, кто приходит в помещение, чувствовал себя уверенно и раскованно. Такая атмосфера офиса расположит собеседника, внушит доверие, как к компании, так и к её сотрудникам. На первый взгляд, задача кажется простой – оформить офис в деловом стиле, но на практике, это довольно сложно. Для того чтобы дизайн получился в наилучшем виде, надо доверится профессионалам. 
Для офиса лучше всего подходит интерьер в стиле хай-тек. Данный стиль существует уже не одно поколение и завоевал к себе уважение. Здесь отделка помещений выполняется при помощи современных материалов. Самыми распространёнными из них являются стекло, бетон, металл, пластик, камень и другие.
Что касается интерьера ресторана и магазина, то тут очень важным моментом является возможность произвести хорошее первое впечатление, так как именно от него зависит, вернуться ли клиенты вновь. Обычно в эти заведения приходят на недолгое время, с целью развлечься, отдохнуть. 
В интерьере должны отсутствовать элементы декора, которые дисциплинируют или создают напряжённую, рабочую обстановку. Обычно ресторан оформлен в классическом стиле, но также часто можно встретить ресторан в восточном и японском или в любом другом стиле. Все зависит от того, для какого контингента выполняется оформление ресторана. Например, влюбленные люди посещают рестораны романтического стиля, в то время как деловые партнеры скорее пойдут в ресторан, оформленный в классическом стиле. 
Что касается магазина, то тут необходимо учитывать не только красоту и функциональность помещения, но и то, насколько удобно расположены примерочные помещения и стеллажи. 
При выборе дизайна интерьера лучше всего довериться профессионалам, которые в подробностях расскажут все плюсы и минусы конкретного стиля и качественно выполнят необходимые работы.",,,,
,"Интерьер кафе, ресторана",,,"Говоря об интерьере помещения, в котором планируется открыть кафе, необходимо отметить, что он должен быть максимально приятным для посетителей этого заведения. Здесь должно быть очень уютно и приятно не только покушать, но и получить удовольствие от процесса общения. В связи с этим, интерьер данного заведения должен быть продуман до мелочей.
Для начала, необходимо определиться, какой тематике будет соответствовать заведение. Даже, если оно будет предназначено для короткого пребывания в нем, надо четко понимать, в каком стилевом решении будет выполнен дизайн интерьера. Существует масса вариантов различных стилей для подобного рода заведений. Наиболее популярными считаются классика, консерватизм, романтизм, модерн, техно, японский стиль и другие. Все зависит от фантазий и желаний собственника бизнеса, а также опыта и фантазии дизайнера, и, конечно же, от цели и статуса будущего кафе.
Например, кафе для маленьких деток, может быть оформлено с помощью иллюстрации к какому-нибудь популярному мультику или сказки. Дизайн интерьера должен быть соответственным интересу детей. Там могут быть маленькие столики, оформленные под гигантские грибы или огромные сказочные пни. 
Что касается пола, то он может быть оформлен, как лесная опушка. Сейчас довольно популярны полузакрытые кабинки, они могут иметь вид сказочных избушек. Или, например, в стиле палаты царя из сказки &amp;quot;Снегурочка&amp;quot;, где есть в наличии тяжёлые дубовые столы, стулья оформленные резьбой, а на окнах витражи. В таком интерьере будет интересно находиться не только детям, но и взрослым. 
Если кафе предназначено для деловых обедов и переговоров, то интерьер скорее подойдет классический. Все должно быть выдержано в едином стиле. Для того чтобы посетители не слишком сильно отвлекались на окружающую обстановку, но и при этом наслаждались ею. Если есть желание иметь экзотический тихий уголок, то можно прибегнуть к японскому стилю. Данный стиль создать довольно легко, потому что главным его отличием является пространство, пустота и свет. Ну и, конечно же, тут должны быть специальные атрибуты декора. В качестве элементов оформления могут служить тонкие перегородки, красные фонари, удивительные пейзажи на стенах. Персонал можно подобрать японской национальности, однако стоит заказать униформу, напоминающую традиционную одежду Японии. 
Можно также создать интерьер в стиле Востока. Например, двери раздвигаются, и перед глазами посетителей вырисовывается образ чайной церемонии. Тут присутствуют циновки на полу, постельные тона стен, невысокие столики. Ведь это не только интересный интерьер, а уникальная философия Востока. В таком интерьере посетители могут отдохнуть от житейских проблем и полностью погрузиться в созерцание прекрасного и вечного. 
Мотивом дизайна кафе может стать и китайский традиционный стиль. Например, помещение оформленное, в национальные цвета: золотой и красный.
Важным моментов в интерьере также считается освещение. Благодаря ему можно создать любую обстановку. При выборе конкретного дизайна кафе, следует иметь чёткое представление об основном контингенте, который будет посещать его и отталкиваться от этого видения.",,,,
,Дизайн как искусство,,,"Комфортный интерьер должен сочетать гармоничность, эстетичность и уникальность. Он должен заряжать жителей данного пространства и его гостей позитивом, и при этом в совершенстве выполнять все необходимые живущим в нём людям бытовые функции. Существует мнение, что порой достаточно наполнять интерьер всеми понравившимися вам материалами и предметами, однако, чтобы добиться качественного результата, необходимы настоящие профессионалы или хотя бы люди, не лишённые природного чутья. В ином случае вряд ли вы добьётесь чего-нибудь стоящего. 

Поскольку в отдельности материалы и предметы могут быть весьма привлекательными, но совершенно не сочетающимися друг с другом, как бы вам того ни хотелось. Поэтому при выборе правильного дизайна интерьера нужно не просто подобрать стиль и в той или иной степени, дополняющие его вещи, а окунуться в творческую работу сотворения самой концепции проекта. Она представляет собой гармоничное, уникальное соитие основных моментов композиции интерьера, а именно: его техническую, функциональную и эстетическую часть – при этом созвучных между собой в данном пространстве и для определённых людей. Что является настоящим искусством, не имеющим никаких правил и ограничений, не поддающееся каким-либо стандартам. 

Концепция интерьера должна быть разработана в соответствии с вашими воззрениями и всеми пожеланиями, разумеется, в границах возможности реализовать всё в последующем. Чтобы разрешить такую непростую задачу, лучше всего позволить её решить специалистам в данной области, о квалификации коих вы можете судить по их предоставленным чертежам и эскизам, поскольку именно по ним легко и наиболее полно определяется творческая идея и творческих потенциал, который проявлен в работе. 

Каждый человек от природы абсолютно уникален, а, следовательно, каждый обустраивается в соответствии со своей природной гармонией и уникальностью. И, конечно же, каждый создаёт своё личное пространство абсолютно индивидуальным или, по крайней мере, всячески стремится к этому. Поэтому дизайн интерьера – творение гармоничное и уникальное, а дело дизайнера – лишь помочь сотворить это произведение искусства.",,,,
