id,title,slug,image,text,text,tags,stext,tags
,Детская для мальчиков,,,"Работая над интерьером детской комнаты необходимо помнить, что ребенок будет расти, и с ним будут расти его потребности. Для удобства желательно комнату разделить на две зоны – одна для игр, другая для отдыха. Придерживаясь таких правил можно обеспечить детям самые замечательные условия для всестороннего развития. 

Комната должна быть украшена игрушками, картинками, всем тем, что вызывает радость у ребенка. Дизайн интерьера, таким образом, сможет обозначить и подчеркнуть характер ребенка.
Цветовая гамма, используемая для оформления детской комнаты не должна раздражать и вызывать чрезмерную активность. Поэтому некоторые дизайнеры предлагают весьма оригинальный подход к украшению детской комнаты для мальчиков. Классическая цветовая гамма и своеобразный набор аксессуаров, каждый из которых является настоящим волшебным открытием в мальчишеском кругу, пробуждают теплые и приятные чувства. 

Такую цветовую гамму, ввиду своей специфичности и оригинальности, очень не часто можно обнаружить в детском декоре, так как это довольно приглушенные краски авиационной тематики, эстетики странствий и спортивной формы. Дизайн интерьера не обладает четкой и однозначно выраженной темой, и в интерьере царит художественный беспорядок, который при более детальном рассмотрении складывается в картину уюта и покоя. Главный цвет в этой схеме это глубокий синий. Он немного разбавлен серым, бежевым и бронзовым. Главную задачу, которую решила такая специфичная цветовая гамма, это создание строгой, практически спартанской атмосферы и в то же время, домашнего уюта.

При помощи темных занавесок на окнах и ящиков для игрушек с металлическим кантом, интерьеру добавлена индустриальная строгость, которая разбавлена фотографиями старинных карт «необитаемых островов» под стеклом, предметами морского антуража, развеивающих обстановку и приглашающих мальчишек окунуться в приключенческие истории первопроходцев и мореплавателей.",,,,
,Дизайн однокомнатной квартиры,,,"Планируя дизайн интерьера этой единственной комнаты, которая служит и гостиной и спальней, и столовой, необходимо максимально с пользой использовать все предоставленное пространство.

Один из самых функциональных способов для увеличения размеров комнаты, это объединение комнаты с кухней. Необходимо снести стену, если она не несущая между комнатой и кухней. Можно также сделать в стене арочный вход, который визуально увеличит пространство. А для разделения помещение на полезные зоны, такие как кабинет, спальня, гостиная, и кухня, можно прибегнуть к таким хитростям, как барная стойка или разноуровневые полы.

Основополагающий нюанс при декорировании интерьера маленького помещения это правильно подобранный цвет. Темные тона, например, визуально уменьшают пространство, а светлые, наоборот, увеличивают. Цветовую гамму лучше минимизировать.

Также большое значение в увеличении пространства имеют правильно выбранные шторы. Шторы из плотной и тяжелой ткани - не самый хороший выбор для помещения, а тонких занавесок может оказаться недостаточно, поэтому оптимальный выбор, это плотные тканевые жалюзи, которые скроят и от солнца и смотреться будут легко и невесомо.

Так как комната одна, и она служит практически и гостиной и спальней, то для большого удобства можно разделить помещение на зоны. Это возможно осуществить, прибегая к использованию ширм и разноуровневых полов. Также данного эффекта можно добиться при помощи комбинирования отделочных материалов. Главное необходимо помнить, что каждая зона нуждается в своем освещении, и в однокомнатной квартире лучше выбрать точечное освещение, нежели чем центральное, или скомбинировать два типа освещения, например, люстра для всей комнаты и светильники в разных ее частях.

Выбирая интерьер, следует уделить внимание мебели. Мебель должна быть максимально функциональной. Кровать лучше заменить диван-кроватью. Днем это будет диван в гостиной, а ночью полноценным спальным местом.

Шкафы лучше использовать встраиваемые, с раздвижными дверями. Это сэкономит лишние квадратные метры, а так как большинство шкафов наделены зеркальными дверями, которые будут не только красиво выглядеть в интерьере, но и визуально увеличат пространство. Для хранения вещей, возможно, использовать навесные подпотолочные полки и стеллажи.

Стол в малогабаритном помещении тоже должен быть функционален, так как площадь помещения не позволяет приобрести отдельно обеденный, компьютерный, или письменный стол. Сам оптимальный вариант, если стол достаточно легок и его конструкция предусматривает регулировку высоты ножек и площади столешницы. Дополнить такой стол можно складными стульями.

Таким образом, руководствуясь этими простыми идеями по преобразованию помещения, можно правильным образом распланировать интерьер малогабаритной однокомнатной квартиры.",,,,
,Украшаем пространство. Волшебный новогодний дизайн интерьера,,,"Еще заранее для создания замечательного волшебного новогоднего настроения необходимо продумать все мельчайшие подробности и праздничного меню, и соответственно праздничного дизайна помещения. 

Любой дизайн интерьера начинается с идеи, и прежде чем купить елку и праздничную мишуру и новогодние украшения, нужно определиться с общей идеей оформления помещения. Необходимо решить в каком стиле будет оформляться интерьер, и от выбранной концепции следует исходить при выборе украшений для дома. Сейчас магазины предлагают огромный ассортимент новогодних украшений на любой вкус и на любой карман и сложностей с подбором важных новогодних украшений и аксессуаров не возникнет. Но для того чтобы минимизировать затраты на покупку украшений, можно обрести праздничное настроение в дизайне интерьера изготовленными своими руками украшениями. К примеру, кроме традиционных отечественных украшений в виде мишуры и гирлянд, можно в декоре использовать передовой опыт западных стран.

Так, последнее время, очень актуальны в новогодних интерьерах венки из веток, елочных шаров, лент, шишек. Подобный венок очень легко можно сотворить самостоятельно. Для венка из елочных шариков потребуется всего лишь кусачки, отрезок крепкой проволоки, широкая красивая лента и елочные шары. Из проволоки делается кольцо нужного размера. На него нанизывают шары, которые размещаются, для более красочного вида, в различном направлении. После маскировки проволоки хвойным лапником и декоративной лентой, потрясающее и стильное украшение готово. Теперь им можно украсить дверь или стену.

Еще одна замечательная идея для новогоднего интерьера - это гирлянда, но не скучная традиционная, которую развешивают вдоль стен, а вертикальная. Для создания такого украшения необходим простой подручный материал в виде фетра, бумаги или плотной ткани. Из этого материала необходимо нарезать разного диаметра круги, которые потом приклеиваются на прочные нити, чередуя их друг с другом, чтобы на одной нитке оказались только круги различного диаметра. Полученную гирлянду можно закрепить на двери или потолке или в любом другом подходящем месте. 

Специфика изготовления таких милых предметов новогодних украшений очень проста в осуществлении, в результате таких простых и не слишком трудоемких действий получается стильная и оригинальная вещь, а также радостное настроение у всей семьи.",,,,
,Монохромность в дизайне,,,"Дизайн интерьера жилого помещения всегда подразумевает собой ориентацию на удобство и гармонию. В зависимости от количества комнат и от пристрастия к каким-либо направлениям и стилям, в основном каждая комната в помещении обустраивается индивидуальным образом. Так и глазу приятнее, и с точки зрения комфортабельности более уютно и стильно. Но когда жилое помещение малогабаритное и отдается предпочтение какому-либо одному стилю и любимому цвету, то существует такое интересное дизайнерское решение, как оформление помещения в одной цветовой гамме. 

Такой подход к оформлению может оказаться достаточно сложновыполнимой задачей, и, самым коварным моментом здесь является подбор правильного основного тона. Однотонный дизайн интерьера может произвести различное впечатление, от восторженного до гнетущего, и это зависит от мельчайших нюансов цветовой палитры, и ее правильного применения.

Комнаты, которые выполнены в одном, например бледном пастельном тоне, будут создавать атмосферу покоя и умиротворения, но возможно могут показаться слишком скучными. Однотонный интерьер, выдержанный в очень ярком, насыщенном цвете, кажется более динамичным и объемными – больше эмоций, гуще тени. Но, ввиду яркости применимых красок он может показаться либо вульгарным, либо просто сильно раздражать. 

И чтобы осуществить затею о монохромном интерьере, так чтобы это было красочно и приятно глазу, нужно придерживаться ряда основных правил. Во-первых, необходимо разбавлять оформление точечными элементами, которые выдержаны в едва-едва отличающихся оттенках. Такие незаметные нюансы создают глубину и определяют общий образ комнат, делая интерьер более интересным и живым. Во-вторых, желательно использовать контрастные текстуры, так как они передают один и тот же цвет по-разному. В-третьих, при работе только с одним цветом или оттенком, необходимо разбавлять его маленькими нейтральными вставками. Для такой цели хорошо подходят фрагменты древесины и белого цвета.

Таким образом, руководствуясь этими легкими в исполнении правилами можно создать уютный монохромный дизайн интерьера.",,,,
,Фитодизайн,,,"Дизайн интерьера растениями давно вышел за пределы обыкновенных горшков на подоконнике. Развилось специальное направление дизайна, основывающееся на украшении помещения растениями. 

Большинство людей считают, что для фитодизайна непременно подразумевается специальное помещение, отведенное для растений. На самом же деле смысл заключается не в количестве растений, а в правильном их подборе и сочетании. 

В первую очередь необходимо определиться с той частью помещения, где будет фитодизайн. Но не стоит забывать, что например, на балконе украшение интерьера будет сезонным, так как даже на застекленном балконе для растений зимой будет не уютно.

Также можно оставить под дизайн часть комнаты. Всю комнату засаживать растениями не стоит, так как такой сад в городском интерьере будет смотреться неуместно. Очень часто в интерьере используются напольные растения, такие как цитрусовые, пальмы, и вертикальное озеленение. 

Данный вид озеленения замечательно тем, что занимает малое количество полезной площади. Решившись на такой специфический дизайн квартиры, нужно определить не только виды растений, но и возможность правильного ухода за ними.

Существует несколько правил фитодизайна интерьера. А именно, все зеленые насаждения должны соответствовать масштабам помещения и правильно сочетаться друг с другом. Чем больше сами растения по размеру, тем меньшего количества должно быть при оформлении помещения. И чем больше в помещении мебели - тем меньше должно быть растений. Обои в идеальном виде должны быть бледнее растений. Если фон с мелким рисунком или однотонный, то растения должны иметь крупные листья, а если рисунок настенных покрытий крупный и яркий, то необходимо выбирать зелень с небольшими листиками. 

Так же можно использовать флорариум. Это сосуд, в котором находится композиция из тропических растений. Выглядит это очень оригинально, а особенного ухода не требует.

Фитодизайн интерьера не только специфически преобразит помещение, но и улучшит микроклимат и воздух в комнате. Основная задача это выбрать для оформления полезные растения, которые выделяют фитонциды и производят кислород. И в основном, фитодизайн интерьера можно создать без помощи специалистов, помня о двух важных вещах. Первая - это комфортность для растений, а вторая - чувство меры.",,,,
,Роль дизайнера в создании интерьера помещения,,,"В наше время создание индивидуального дизайна квартир – это неотъемлемая составная часть жизни большинства собственников жилья.

Как известно, клиент всегда прав. И выполнение его требований – это еще одно условие, которым он руководствуется. Именно он устанавливает правила, такие как сроки сдачи объекта, его видение на конечный результат, сам процесс проекта. Поэтому дизайн интерьера квартиры – это то, что устраивает клиента. Обычно владельцам квартир предлагаются следующие услуги: создание индивидуального стиля квартиры с пожеланиями клиента, грамотная реализация проекта, подбор мебели, материалов и оборудования для квартиры, координация всех инженерных технологий и подготовка всей документации. 

Современная квартира должна быть комфортной и удобной для проживания, и в то же время стильной и выдержанной. Для этого есть множество решений, которые дизайнеры готовы предложить вам. Обычно, это тонкий и трудоемкий процесс. Чтобы подобрать каждую деталь к выбранному стилю, необходимо много времени и усилий. Поэтому, если вы не были связаны с этой работой, рекомендуется обратиться к специалистам. Ваша задача – грамотно изложить вашу идею, какой бы нереальной она ни казалось. А дизайнер, в свою очередь, доработает и обязательно предложит вам то, что вас устроит. При этом он будет учитывать различные аспекты, такие как шум из окна, солнечные стороны, цветовая гамма, различные аксессуары. Но все это он будет делать, опираясь на ваши пожелания. Ведь, в конце концов, его задача – не создать очередной свой дизайнерский шедевр, воплощая свои фантазии и умения, а удовлетворить ваши требования, даже если ему это не нравится. 

Но не стоит, все же, полагаться лишь на свои собственные силы, ведь не для этого вы дизайнеру деньги платите? Поверьте, самое грамотное решение предложит именно он, и чтобы интерьер выглядел цельным и свежим, он учтет и эстетические, и практические аспекты данного вопроса. Тем более, что сегодня в магазинах можно приобрести огромный ассортимент отделочных материалов, мебели, предметов интерьера. Поэтому воплощение в жизнь дизайна квартиры вашей мечты представляется вполне реальным.",,,,
