id,title,slug,image,text,text,tags,stext,tags
,Дизайн интерьера. Особенности выбора,,,"Старинная поговорка «Наш дом – наша крепость!» не совсем отвечает современным дизайнерским веяньям, так как современная «крепость» должна быть не только надёжной, но ещё и уютной, стильной, модной и, конечно же, «не такая как у всех». Полет мысли современных мастеров интерьера будоражит фантазию и в тоже время приводит нас в замешательство. Как понять что нужно именно нам? Каков он дом нашей мечты? Попробуем все-таки как-то разобраться в основных направлениях и тенденциях дизайнерской школы ХХІ столетия. 
Громко звучащее сегодня слово «этностиль» понятие очень обширное и для многих хотя и непонятное, но очень манящее. Интерьер в индийском, японском, африканском, китайском стиле… Сколько секретов и тайн скрыто в этих дивных словах! Начнем с главного. Во-первых, конечно же, вам необходимо определиться с континентом и детально изучить, что подразумевает тот или иной этностиль. При выборе полагайтесь не только на ваши предпочтения, но и на вашу личность, образ и уклад жизни, привычки, мировоззрение… В вашем доме, вы и ваша семья, в первую очередь, должны чувствовать себя как дома (а не в музее!), то есть комфортно, спокойно, умиротворенно, удобно. Ваш интерьер должен нравиться вам, а не вашим родным и друзьям. Хотите произвести впечатление о себе любимом, показать ваш статус и разного рода возможности, в таком случае, для этих целей вам следует выбирать другие арены. Во-вторых, не забывайте об общей цельной картине вашей «крепости». Так, интерьер спальни должен гармонично сочетаться со стилем гостиной, например. Но и тут следует помнить правило «золотой середины». Отметим, что привязка к определенному стилю – это просто современная дизайнерская западня для слепых людей, отказывающихся думать, размышлять, создавать, творить, экспериментировать... Неужели вы не повесите на стену картину, нарисованную вашим любимым чадом, если вдруг она по каким-то причинам не вписывается в интерьер вашего любимого рабочего кабинета? Ведь именно этот рисунок позволит вам после тяжелой напряженной работы окунуться в тепло семейного очага, расслабиться и помечтать… А ведь после серьёзной работы и даже в процессе неё это так необходимо! Или как оставить гнить на чердаке любимую корзину вашей прабабушки, только потому, что она, видите ли, не гармонирует с африканским стилем вашей прихожей? А как же тогда насчет приятных воспоминаний, которые заставляют светиться глаза и петь душу?! Впрочем, заметим, что очень часто совсем, на первый взгляд, несовместимые элементы декора, дают фантастический, приятно неожиданный результат. И это нормально! Ведь в соревнованиях между диалогом и монологом, первый всегда идет на шаг вперед. Мы так часто говорим о том, что противоположности притягиваются, так почему бы не провести эксперимент и не создать из несовместимого шедевр? Кроме того, следует всегда учитывать то, что ремонт вы делаете не на месяц и не на год. Выражение «классика – всегда в моде» свои позиции пока не сдаёт, да и не сдаст никогда. Из всего вышесказанного следует вывод: стиль интерьера вашей комнаты, дома или квартиры должен нравиться вам и только вам; ваша «крепость» должна гармонировать с вашим внутренним миром и только тогда она станет настоящим домом для вас, вашей семьи и близких. 
Если вы являетесь поклонником всего что есть «модно», тогда над интерьером вашей квартиры сегодня придётся попотеть именно вам. Конечно, помощь дизайнеров и стилистов лишней не будет, но создать неповторимый образ и шарм вашей обители, который будет близок именно вашему «я», сможете только вы. Речь идет о том, что начало нашего века характеризируется хаосом и неразберихой во всем – тенденциях и направлениях в дизайне одежды, мебели, стилях интерьера, экстерьера и пр. И модным на сегодняшний день считается то, что является неординарным, контрастным, из ряда вон выходящим, диковинным и т.д. И так как двух одинаковых людей не бывает, то и творения их будут отличаться, отображая их самих и независимый уникальный мир каждого.
Если говорить о такой актуальной в наше время ситуации как обитание под одной крышей людей разного возраста и статуса, то и тут психология человека играет первостепенную роль. Люди преклонного возраста естественно предпочтут классику, молодой семье с детьми необходимо брать во внимание вкусы и личностные установки каждого домочадца, а вот молодежи явно подойдет хай-тек, постмодерн или авангард. Раскроем вам секрет – каждый стиль архитектуры не в зависимости от времени, основных положений и характеристик базируется на одном и том же фундаменте – так званных «трех китах» – функциональность, полезность, надежность. А вот разница в стилях возникает, в первую очередь, по причине главенства тех или иных китов. Современный человек ничем не ограничен в свободе выбора стиля, ритма собственной жизни и способов самовыражения. И совершенно очевидно, что от того насколько индивидуален и неповторим человек напрямую зависит и неповторимость интерьера выбранного им для себя.",,,,
,Стены зеленых оттенков,,,"Хотя в природе зеленый цвет периодически исчезает, и его место занимают бежевые и коричневые цвета, дизайн интерьера с использованием зеленых оттенков актуален  круглый год. Зеленые стены успокаивают нервную систему и способствуют образованию положительных жизненных эмоций. Таким образом, мы можем зачерпнуть положительную энергию прямо из природы и покрасить внутренние стены дома в этот цвет. К зеленым стенам, для обеспечения уюта, можно добавить немного старомодных аксессуаров в стиле пэчворк, расположенных, к примеру, на мягком диване.
Зеленые внутренние стены позволяют чувствовать себя свободно и непринужденно в таком интерьере. Кроме этого, они придают интерьеру современный стильный вид.
Окрашенные в пастельные тона кухонные стены являются довольно популярным решением для дополнения интерьера комнаты с зелеными стенами. В совокупности такие два помещения зеленых оттенков придадут интерьеру спокойный характер. Особенно эффективно выглядит сочетание ярко-зеленого цвета со светло-древесными оттенками. 
Стены оливкового цвета тоже отлично вписываются в такой эко-стиль дизайна. Деревянные полки на стенах должны выглядеть как можно естественнее. Таких оттенков стены являются отличным фоном для любого вида растений в соответственных по стилю горшках.
Светло-зеленый оттенок, как и все яркие цвета, будет расширять пространство помещения. Таким образом, актуально его применять в маленькой квартире. Кроме того, комнатные растения занимают много места, и зеленые яркие стены являются хорошим решением для замены части комнатных растений в небольшой квартире.",,,,
,Место телевизора в современном интерьере    ,,,"Современный человек достаточно быстро меняет собственные приоритеты, которые во многом отражаются в дизайне интерьера. Стоит отметить, что даже в недалеком прошлом телевизор являлся центром внимания и ключевым предметом интерьера любой гостиной. А сегодня всех мучает вопрос, как вписать данную технику в дизайн интерьера, чтобы не отклоняться от общей стилистики.
К счастью, современными дизайнерами было разработано большое количество всевозможных вариаций размещения телевизора в любом интерьере, причем он будет гармонировать и выглядеть привлекательно.    
И все же, по каким причинам телевизор так важен в интерьере? Ответ достаточно прост, дело в том, что большинство из нас не видят своей жизни без этого чуда техники. Практически каждый вечер мы располагаемся перед экраном, для просмотра любимых фильмов и сериалов, а также интересных ток-шоу. Как бы ни пытались отрицать, но телевизор все-таки является довольно весомым элементом быта любого человека. 
Интерьер в стиле хай-тек, наверное один из самых простых решений данного вопроса. И это не странно, ведь он базируется на высокотехнологичных элементах, поэтому современный телевизор, сам по себе будет выполнять роль одного из элементов интерьера. В данном случае, оптимальным решением будет размещение телевизора на кронштейнах, в подвешенном состоянии или расположить его в нише.
Если рассматривать классический стиль, необходимо отметить, что он не допускает современных элементов, таких как телевизор, поэтому в гостиной, соответствующей данному типу, подобный предмет интерьера будет смотреться дико и непривычно. Но дизайнеры вышли из положения, завуалировав телевизор, который был оформлен в виде картины, в раме, выполненной из декоративного багета, имеющего классический орнамент. Подобную раму можно расположить на стене, по соседства с остальными картинами или же в специальную нишу, подготовленную заблаговременно. Оригинальным решением будет телевизор в привлекательной раме над камином. 
Этнический интерьер характеризуется расписной мебелью и тканями с орнаментом, поэтому вписать современный телевизор в данную обстановку достаточно сложно. Но и в этой ситуации есть выход. К примеру, разместить телевизор можно внутри шкафа-купе. Это очень удобно, когда телевизор выключен, двери можно закрыть, что позволит скрыть телевизор, чтобы не нарушать общее впечатление гостей об общем интерьере вашей гостиной.  
Достаточно оригинальным решением, будет размещение телевизора в нише, которая будет закрыта раздвижным фасадом, выполненном в этническом стиле, а для того чтобы пользоваться телевизором понадобится просто сдвинуть фасад в сторону.",,,,
,Весенний дизайн интерьера,,,"Жизненный цикл не изменен, после зимы неизбежно наступление весны, а это тепло, с приходом которого появляется желание изменить все в лучшую сторону. Это касается и дизайна интерьера. С весенним солнцем просыпаются наши эмоции и мы хотим больше общения, а соответственно встреч с друзьями. Это ни что иное, как повод обновить дизайн интерьера.
Чтобы придать гостиной весеннюю привлекательность и яркие цвета, необязательно делать капитальный ремонт. Достаточно просто окрасить стены в новый цвет, а можно и одну из стен, придав оригинальности гостиной. Поставленную цель можно реализовать путем внедрения ярких предметов интерьера, которыми могут быть чехлы для мягкой мебели, в ярких тонах, сочетающихся с валиками и подушками. Также можно разместить оригинальные вазы, имеющие всевозможные геометрические формы или другие мелочи, которые будут притягивать внимание ваших гостей, что позволит избежать скучных ноток в интерьере помещения. Живые цветы — это элемент, без которого не обойдется ни один интерьер выполненный в весеннем настроении. Можно использовать растения в горшках или красивые букеты, с незабываемым ароматом тепла.   
Альтернативным вариантом будет использование светлых, пастельных красок. После зимы все соскучились по солнечной теплоте, привычной для весеннего периода, поэтому это самое подходящее время, чтобы насладиться в полной мере достаточным количеством солнечных лучей. Для этого идеальным вариантом будет гостиная, выполненная в бежевых или белых тонах.  
Может показаться, что светлая мебель и светлые стены, могут сливаться. В этом случае можно добавить несколько ярких деталей, таких как фотографии, картины, вазы и другие интересные мелочи. Стоит отметить, что светлая гостиная будет выглядеть визуально больше и просторней. 
Неплохим дополнением к светлым тонам будут пастельные, светло-зеленые или светло-оливковые цвета. 
Для того чтобы гостиная выглядела по настоящему привлекательной, нужно обеспечить достаточное количество естественного света, поэтому необходимо уделить особое внимание выбору штор. Лучше отдать свое предпочтение полупрозрачным и легким занавескам, выполненным из белой органзы или любого другого тонкого материала.",,,,
